Post ID,Title,Body,URL,Subreddit,Upvotes,Created At,Comment Count,Comments (JSON)
t3_1owjtvs,"Apps tem época de alta e de baixa, faça testes!","Em resumo, eu notei isto primeiramente no Bumble, eu usei durante um tempo pré carnaval final de 2024 e início de 2025, tive muitos matches e com mulheres bacanas, mas resolvi sair pois não achava que estava pronto para conhecer alguém (eu não curto mais casual, já foi a fase). E só fui fazer uma nova conta no carnaval, após uns 2 meses e o app estava uma bosta, muita gente de fora aqui na cidade, muito rolê casual e em resumo tive ZERO Matches. Voltei deve ter umas 3 semanas e por não pagar o Premium plus + lá, só apareceu uns gatos pingados de match. 

Tinder foi a mesma coisa, na mesma época (2024 para 2025) muitos likes e Matches, usando o Platinum é claro, acho que bati meu recorde de match e deixando claro que eu uso este trem no máximo 1 mês e desinstalo. Carnaval foi muito fraco e parece que agora começou a bombar mais.

Já no inner circle eu virei o top das galáxias kkkkkk (o app te dá uma nota, baseando na quantidade de pessoas que visitam o seu perfil e o quanto recebe de curtidas e eu recebi 4.7 de 5). Rapaz, só match com gatinhas!!! Mas depois que resolvi excluir a conta (eu sempre uso um mês e excluo) o app não aceitou mais eu fazer conta, tá bugado lá até hoje e não consigo entrar mais. 

Concluindo, eu uso apps desde meus 16 anos e hoje tenho 29, já saiu 3 relacionamentos longos de lá. Lembrando aqui agora, sempre foram pessoas que conheci mais para o fim do ano, as pessoas querem passar o natal e réveillon de casal né?! 

E outro detalhe, eu sempre usei 2 ou mais apps, as pessoas sempre migram, ou apps diferentes atraem pessoas diferentes. É até engraçado, mas se pegar uma amostra grande aqui na minha cidade, tu vai ver que os apps são bem nichados, falo de estilo ou jeito das pessoas mesmo. 

",https://www.reddit.com/r/TinderBR/comments/1owjtvs/apps_tem_época_de_alta_e_de_baixa_faça_testes/,,0,2025-11-14T01:55:59.000Z,0,[]